{
  "title": "Public Prototype Sample",
  "date": "2026-04-06",
  "generated_by": {
    "tool": "context-handoff-bundle",
    "model": "starter-generator"
  },
  "purpose": "Reviewed multiple projects from the last six months to identify overlap, consolidation opportunities, and new product directions.",
  "scope": {
    "repos": [
      "DashClaw",
      "Practical Systems",
      "TreasuryClaw",
      "Budget-Aware Research Agent",
      "OpenClaw-Pro"
    ],
    "folders": [],
    "inputs": [
      "C:\\Users\\sandm\\clawd\\projects\\context-handoff-bundle\\examples\\sample-notes.md"
    ],
    "excluded": [],
    "artifacts_created": [
      "CONTEXT_HANDOFF.md",
      "summary.json",
      "entities.json",
      "relations.json",
      "evidence_index.json",
      "open_questions.json",
      "resume_prompt.txt",
      "bundle_metadata.json"
    ]
  },
  "executive_summary": "Starter handoff generated from structured notes. Intended to preserve direction and reduce re-research, not replace direct source verification.",
  "findings": [
    {
      "id": "F1",
      "title": "DashClaw and Practical Systems overlap in client-facing automation, governance, ",
      "summary": "DashClaw and Practical Systems overlap in client-facing automation, governance, and operational surfaces.",
      "importance": "medium",
      "confidence": "medium",
      "evidence": [
        "C:/Projects/DashClaw/README.md",
        "C:/Projects/DashClaw/PROJECT_DETAILS.md"
      ],
      "implications": []
    },
    {
      "id": "F2",
      "title": "The budget-aware research agent is a promising x402 wedge and should remain legi",
      "summary": "The budget-aware research agent is a promising x402 wedge and should remain legible as a standalone capability even if folded into a larger platform.",
      "importance": "medium",
      "confidence": "medium",
      "evidence": [
        "C:/Projects/DashClaw/README.md",
        "C:/Projects/DashClaw/PROJECT_DETAILS.md"
      ],
      "implications": []
    },
    {
      "id": "F3",
      "title": "TreasuryClaw proved there is value in strong constrained workflows with real art",
      "summary": "TreasuryClaw proved there is value in strong constrained workflows with real artifacts and evaluation.",
      "importance": "medium",
      "confidence": "medium",
      "evidence": [
        "C:/Projects/DashClaw/README.md",
        "C:/Projects/DashClaw/PROJECT_DETAILS.md"
      ],
      "implications": []
    },
    {
      "id": "F4",
      "title": "Several projects share the same underlying pattern: agent capability plus oversi",
      "summary": "Several projects share the same underlying pattern: agent capability plus oversight plus durable artifacts.",
      "importance": "medium",
      "confidence": "medium",
      "evidence": [
        "C:/Projects/DashClaw/README.md",
        "C:/Projects/DashClaw/PROJECT_DETAILS.md"
      ],
      "implications": []
    }
  ],
  "recommendations": [
    {
      "priority": 1,
      "action": "Merge overlapping governance and operational concepts into DashClaw v3.",
      "why": "Captured from the opportunities section of the source notes.",
      "depends_on": [],
      "risk": "Needs direct validation against current repo state."
    },
    {
      "priority": 2,
      "action": "Treat Practical Systems as service delivery and DashClaw as platform substrate.",
      "why": "Captured from the opportunities section of the source notes.",
      "depends_on": [],
      "risk": "Needs direct validation against current repo state."
    },
    {
      "priority": 3,
      "action": "Preserve reusable artifacts across sessions to reduce re-research cost.",
      "why": "Captured from the opportunities section of the source notes.",
      "depends_on": [],
      "risk": "Needs direct validation against current repo state."
    }
  ],
  "resume_instructions": {
    "read_first": [
      "CONTEXT_HANDOFF.md",
      "summary.json",
      "evidence_index.json"
    ],
    "assumptions_to_continue_from": [
      "DashClaw and Practical Systems overlap in client-facing automation, governance, and operational surfaces.",
      "The budget-aware research agent is a promising x402 wedge and should remain legible as a standalone capability even if folded into a larger platform.",
      "TreasuryClaw proved there is value in strong constrained workflows with real artifacts and evaluation.",
      "Several projects share the same underlying pattern: agent capability plus oversight plus durable artifacts."
    ],
    "must_reverify": [
      "Which projects should remain branded separately versus folded inward?",
      "What is the right boundary between product, consulting layer, and internal operating system?"
    ]
  }
}